{
  "format_version": "1.21.11",
  "credit": "Made by Mosberg",
  "parent": "brewery:block/template_kettle_full",
  "textures": {
    "bottom": "brewery:block/kettle_bottom",
    "content": "minecraft:block/water_still",
    "inside": "brewery:block/kettle_inner",
    "particle": "brewery:block/kettle_side",
    "side": "brewery:block/kettle_side",
    "top": "brewery:block/kettle_top"
  }
}
